{
  "schema_version": "1.0",
  "last_updated": "2026-02-18T14:35:00",
  "trades": [
    {
      "trade_id": "3228a96e-46e3-4e6e-b63f-eaf84db209e0",
      "timestamp": "2026-02-17T09:30:00",
      "date": "2026-02-17",
      "account": "SEP-IRA",
      "broker": "Schwab",
      "ticker": "PANW",
      "strategy": "CSP",
      "action": "OPEN",
      "direction": "SELL",
      "quantity": 9,
      "strike": 136.0,
      "expiration": "2026-02-20",
      "option_type": "PUT",
      "entry_premium": 0.53,
      "exit_premium": 0.07,
      "total_credit": 477.0,
      "total_debit": 63.0,
      "realized_pnl": 414,
      "fees": 0.0,
      "days_held": 1,
      "status": "CLOSED",
      "close_date": "2026-02-18",
      "notes": "Beat 4 of last 5 quarters",
      "related_trade_id": null
    },
    {
      "trade_id": "f8cd21c4-e95a-4e28-ae17-b22a2a0b7a5c",
      "timestamp": "2026-02-17T09:30:00",
      "date": "2026-02-17",
      "account": "SEP-IRA",
      "broker": "Schwab",
      "ticker": "MCO",
      "strategy": "CSP",
      "action": "OPEN",
      "direction": "SELL",
      "quantity": 1,
      "strike": 370.0,
      "expiration": "2026-02-20",
      "option_type": "PUT",
      "entry_premium": 1.15,
      "exit_premium": 0.06,
      "total_credit": 115.0,
      "total_debit": 6.0,
      "realized_pnl": 109,
      "fees": 0.0,
      "days_held": 1,
      "status": "CLOSED",
      "close_date": "2026-02-18",
      "notes": "Moody's earnings play",
      "related_trade_id": null
    },
    {
      "trade_id": "a1b2c3d4-e5f6-7890-abcd-ef1234567890",
      "timestamp": "2026-02-17T09:30:00",
      "date": "2026-02-17",
      "account": "SEP-IRA",
      "broker": "Schwab",
      "ticker": "MCO",
      "strategy": "CSP",
      "action": "OPEN",
      "direction": "SELL",
      "quantity": 1,
      "strike": 380.0,
      "expiration": "2026-02-20",
      "option_type": "PUT",
      "entry_premium": 2.20,
      "exit_premium": 0.10,
      "total_credit": 220.0,
      "total_debit": 10.0,
      "realized_pnl": 210,
      "fees": 0.0,
      "days_held": 1,
      "status": "CLOSED",
      "close_date": "2026-02-18",
      "notes": "Moody's earnings play",
      "related_trade_id": null
    },
    {
      "trade_id": "b2c3d4e5-f6a7-8901-bcde-f12345678901",
      "timestamp": "2026-02-17T09:30:00",
      "date": "2026-02-17",
      "account": "Robinhood",
      "broker": "Robinhood",
      "ticker": "PANW",
      "strategy": "CSP",
      "action": "OPEN",
      "direction": "SELL",
      "quantity": 8,
      "strike": 140.0,
      "expiration": "2026-02-20",
      "option_type": "PUT",
      "entry_premium": 0.56,
      "exit_premium": 0.58,
      "total_credit": 448.0,
      "total_debit": 464.0,
      "realized_pnl": -16,
      "fees": 0.0,
      "days_held": 1,
      "status": "CLOSED",
      "close_date": "2026-02-18",
      "notes": "Small loss on position",
      "related_trade_id": null
    },
    {
      "trade_id": "c3d4e5f6-a7b8-9012-cdef-123456789012",
      "timestamp": "2026-02-18T10:00:00",
      "date": "2026-02-18",
      "account": "Robinhood",
      "broker": "Robinhood",
      "ticker": "WMT",
      "strategy": "CSP",
      "action": "OPEN",
      "direction": "SELL",
      "quantity": 5,
      "strike": 115.0,
      "expiration": "2026-02-20",
      "option_type": "PUT",
      "entry_premium": 0.38,
      "exit_premium": null,
      "total_credit": 190.0,
      "total_debit": null,
      "realized_pnl": null,
      "fees": 0.0,
      "days_held": null,
      "status": "OPEN",
      "close_date": null,
      "notes": "Grade A, 100% ↓1.5x EM",
      "related_trade_id": null
    },
    {
      "trade_id": "d4e5f6a7-b8c9-0123-defa-234567890123",
      "timestamp": "2026-02-18T10:00:00",
      "date": "2026-02-18",
      "account": "Robinhood",
      "broker": "Robinhood",
      "ticker": "WMT",
      "strategy": "CSP",
      "action": "OPEN",
      "direction": "SELL",
      "quantity": 2,
      "strike": 116.0,
      "expiration": "2026-02-20",
      "option_type": "PUT",
      "entry_premium": 0.40,
      "exit_premium": null,
      "total_credit": 80.0,
      "total_debit": null,
      "realized_pnl": null,
      "fees": 0.0,
      "days_held": null,
      "status": "OPEN",
      "close_date": null,
      "notes": "Grade A, 100% ↓1.5x EM",
      "related_trade_id": null
    },
    {
      "trade_id": "e5f6a7b8-c9d0-1234-efab-345678901234",
      "timestamp": "2026-02-18T10:00:00",
      "date": "2026-02-18",
      "account": "Robinhood",
      "broker": "Robinhood",
      "ticker": "EBAY",
      "strategy": "CSP",
      "action": "OPEN",
      "direction": "SELL",
      "quantity": 10,
      "strike": 71.0,
      "expiration": "2026-02-20",
      "option_type": "PUT",
      "entry_premium": 0.38,
      "exit_premium": null,
      "total_credit": 380.0,
      "total_debit": null,
      "realized_pnl": null,
      "fees": 0.0,
      "days_held": null,
      "status": "OPEN",
      "close_date": null,
      "notes": "Grade B, 98% ↓1.5x EM",
      "related_trade_id": null
    },
    {
      "trade_id": "f6a7b8c9-d0e1-2345-fabc-456789012345",
      "timestamp": "2026-02-18T13:30:00",
      "date": "2026-02-18",
      "account": "SEP-IRA",
      "broker": "Schwab",
      "ticker": "CVNA",
      "strategy": "CSP",
      "action": "OPEN",
      "direction": "SELL",
      "quantity": 5,
      "strike": 257.5,
      "expiration": "2026-02-20",
      "option_type": "PUT",
      "entry_premium": 1.57,
      "exit_premium": null,
      "total_credit": 785.0,
      "total_debit": null,
      "realized_pnl": null,
      "fees": 0.0,
      "days_held": null,
      "status": "OPEN",
      "close_date": null,
      "notes": "Grade C-, 75% ↓1.5x EM - HIGH RISK",
      "related_trade_id": null
    },
    {
      "trade_id": "a7b8c9d0-e1f2-3456-abcd-567890123456",
      "timestamp": "2026-02-18T13:30:00",
      "date": "2026-02-18",
      "account": "SEP-IRA",
      "broker": "Schwab",
      "ticker": "DASH",
      "strategy": "CSP",
      "action": "OPEN",
      "direction": "SELL",
      "quantity": 6,
      "strike": 140.0,
      "expiration": "2026-02-20",
      "option_type": "PUT",
      "entry_premium": 0.59,
      "total_credit": 354.0,
      "total_debit": null,
      "realized_pnl": null,
      "fees": 0.0,
      "days_held": null,
      "status": "OPEN",
      "close_date": null,
      "notes": "Grade C, 90% ↓1.5x EM - MODERATE RISK",
      "related_trade_id": null
    },
    {
      "trade_id": "b8c9d0e1-f2a3-4567-bcde-678901234567",
      "timestamp": "2026-02-18T13:30:00",
      "date": "2026-02-18",
      "account": "SEP-IRA",
      "broker": "Schwab",
      "ticker": "WMT",
      "strategy": "CSP",
      "action": "OPEN",
      "direction": "SELL",
      "quantity": 9,
      "strike": 116.0,
      "expiration": "2026-02-20",
      "option_type": "PUT",
      "entry_premium": 0.395,
      "total_credit": 356.0,
      "total_debit": null,
      "realized_pnl": null,
      "fees": 0.0,
      "days_held": null,
      "status": "OPEN",
      "close_date": null,
      "notes": "Grade A, 100% ↓1.5x EM",
      "related_trade_id": null
    }
  ],
  "summary": {
    "total_trades": 10,
    "open_positions": 6,
    "closed_positions": 4,
    "ytd_realized_pnl": 717,
    "ytd_premium_collected": 3445
  }
}
